{
  "page_type": "institution_leaf",
  "url": "/landmarks/institutions/anwar-ul-uloom-college/",
  "section": "Landmarks",
  "title": "Anwar-ul-Uloom College",
  "description": "Founded in 1953 by the Anwarul Uloom Educational Association, Anwar-ul-Uloom College on Mallepally became a principal seat of Urdu scholarship in Hyderabad.",
  "dedication": "In memory of the Asaf Jahi dynasty",
  "sort_order": 110,
  "tags": [
    "Anwar ul Uloom",
    "Hyderabad",
    "Islamic Studies",
    "Education"
  ],
  "eyebrow": "Institutions of the Deccan",
  "title_html": "Anwar-ul-Uloom College",
  "subtitle": "Hyderabad · Founded 1953",
  "link_terms": [
    "Anwar-ul-Uloom College"
  ],
  "blocks": [
    {
      "type": "facts",
      "items": [
        {
          "key": "Founded",
          "value": "1953",
          "ref": "anwarululoom-official"
        },
        {
          "key": "Founded by",
          "value": "Anwarul Uloom Educational Association",
          "ref": "anwarululoom-official"
        },
        {
          "key": "Association formed",
          "value": "1909",
          "ref": "anwarululoom-official"
        },
        {
          "key": "City",
          "value": "Hyderabad"
        }
      ]
    },
    {
      "type": "narrative",
      "tour_label": "The College",
      "tour": [
        {
          "id": "s1",
          "label": "The Association"
        },
        {
          "id": "s2",
          "label": "The College"
        },
        {
          "id": "s3",
          "label": "Today"
        }
      ],
      "intro": "<p><em>Anwar-ul-Uloom College</em>, founded at Hyderabad in 1953, was a principal community-founded institution of higher Urdu learning in the Deccan. It was established by the <em>Anwarul Uloom Educational Association</em>, a Hyderabad body formed in 1909 in the same wider movement for Urdu-medium education that had produced the <em>Anjuman-e-Taraqqi-e-Urdu</em> — the influential society for the advancement of Urdu founded at Aligarh in 1903 and later led in Hyderabad by <em>Imadul-Mulk Sayyid Husain Bilgrami</em> and his circle. The college grew on the Mallepally quarter of the old city into a full degree-granting institution and, more recently, an engineering and management institution. It stands as the community's own complement to the state-founded Osmania.<cite data-ref=\"anwarululoom-official\"></cite></p>",
      "sections": [
        {
          "id": "s1",
          "eyebrow": "Community Education · 1909",
          "numeral_label": "The Association",
          "title_html": "The <em>Association</em>",
          "sub": "The Anwarul Uloom Educational Association and the wider Urdu-reform movement",
          "body": [
            "The Anwarul Uloom Educational Association was formed at Hyderabad in 1909, part of the same era of community organising for Urdu-medium education that produced the Aligarh-founded Anjuman-e-Taraqqi-e-Urdu in 1903. Four decades later, the Association founded Anwar-ul-Uloom College, which became the largest of its educational undertakings in the city.<cite data-ref=\"anwarululoom-official\"></cite>"
          ],
          "reveal": "reveal-left"
        },
        {
          "id": "s2",
          "eyebrow": "Mallepally · 1953",
          "numeral_label": "The College",
          "title_html": "The <em>college</em>",
          "sub": "An Osmania-affiliated college built around Urdu letters and Islamic studies",
          "body": [
            "Established in 1953 in a modest but dignified institutional manner on Mallepally, the college taught the standard Osmania syllabus in Urdu and later in English, with a particular strength in Urdu literature and Islamic studies. It produced several generations of Urdu writers and journalists of the city."
          ],
          "reveal": "reveal-right"
        },
        {
          "id": "s3",
          "eyebrow": "A Living Federation",
          "numeral_label": "Today",
          "title_html": "Continuing <em>life</em>",
          "sub": "One of the largest community-run educational complexes of the city",
          "body": [
            "Now run by the Anwar-ul-Uloom Educational Society as a federation of arts, science, commerce, engineering, pharmacy and management colleges, it remains one of the largest community-managed educational complexes of Hyderabad.<cite data-ref=\"anwarululoom-official\"></cite>"
          ],
          "reveal": "reveal-left"
        }
      ]
    }
  ],
  "references": [
    {
      "id": "anwarululoom-official",
      "text": "Anwarul Uloom College (Autonomous), Hyderabad — official website.",
      "url": "https://anwarululoom.in/"
    }
  ],
  "indexing": "noindex"
}
