{
  "page_type": "section_hub",
  "url": "/sacred-sites/",
  "section": "Sacred Sites",
  "title": "Sacred Sites of the Deccan",
  "description": "The sacred sites of the Deccan — historic masjids, Sufi dargahs, ancient temples and the shrines of other faiths across the plateau.",
  "dedication": "In memory of the Asaf Jahi dynasty",
  "eyebrow": "Masjids · Dargahs · Temples · Shrines",
  "title_html": "Sacred Sites of the Deccan",
  "subtitle": "The mosques, Sufi shrines, temples and houses of other faiths that together form the religious landscape of the plateau.",
  "body_html": "<div class=\"article-intro\">\n  <p>The religious landscape of the Deccan is layered like nowhere else in India. The Friday mosques of the Bahmani, Adil Shahi and Qutb Shahi sultans stand within sight of the Sufi dargahs whose saints gave their dynasties legitimacy; the ancient temples of the plateau predate them all; and the churches, gurudwaras and other houses of worship of the colonial and modern city complete the picture. Together they make the Deccan one of the most religiously plural regions of the subcontinent.</p>\n  <p>This section gathers the sacred architecture of the plateau by tradition. Each page records the buildings themselves — their patrons, their architecture and their place in the life of the city — while the lives of the saints they enshrine are given in the <a href=\"/sufism/\">Sufism</a> section.</p>\n</div>\n\n<section class=\"card-grid-wrap\">\n<div class=\"card-grid\">\n  <a href=\"/sacred-sites/masjids/\" class=\"card\">\n    <span class=\"card-eyebrow\">Mosques · 14th–20th c.</span>\n    <h3 class=\"card-title\">Masjids</h3>\n    <p class=\"card-meta\">Bahmani · Adil Shahi · Qutb Shahi · Asaf Jahi</p>\n    <p class=\"card-text\">The historic mosques of the Deccan — from the all-domed Bahmani jami at Gulbarga and the Solah Khamba of Bidar, through the gilt-inscribed prayer halls of Bijapur, to the Mecca Masjid and the Spanish Mosque of Hyderabad.</p>\n    <span class=\"card-cta\">Explore →</span>\n  </a>\n  <a href=\"/sacred-sites/dargahs/\" class=\"card\">\n    <span class=\"card-eyebrow\">Sufi Shrines · 1337 onward</span>\n    <h3 class=\"card-title\">Dargahs</h3>\n    <p class=\"card-meta\">Chishti · Qadiri · Suhrawardi · Naqshbandi</p>\n    <p class=\"card-text\">The great Sufi shrines of the plateau — Khuldabad, Bandanawaz at Gulbarga, Pahadi Sharif, Maula Ali and the Yousufain shrine of Hyderabad — spiritual and social centres for seven centuries.</p>\n    <span class=\"card-cta\">Explore →</span>\n  </a>\n  <a href=\"/sacred-sites/temples/\" class=\"card\">\n    <span class=\"card-eyebrow\">Temples · Ancient & Medieval</span>\n    <h3 class=\"card-title\">Temples</h3>\n    <p class=\"card-meta\">Kakatiya · Chalukya · later Deccan</p>\n    <p class=\"card-text\">The temple architecture of the Deccan, from the Kakatiya masterpieces of Warangal and Palampet to the living temples of Hyderabad and the plateau — the oldest layer of the region's sacred landscape.</p>\n    <span class=\"card-cta\">Explore →</span>\n  </a>\n  <a href=\"/sacred-sites/religious-structures/\" class=\"card\">\n    <span class=\"card-eyebrow\">Other Faiths</span>\n    <h3 class=\"card-title\">Other Faiths</h3>\n    <p class=\"card-meta\">Churches · Gurudwaras · further shrines</p>\n    <p class=\"card-text\">The churches, gurudwaras and other houses of worship of the Deccan — the religious structures of the colonial and modern city that complete the plural fabric of the plateau.</p>\n    <span class=\"card-cta\">Explore →</span>\n  </a>\n</div>\n</section>",
  "extra_scripts": []
}
