{
  "page_type": "institution_leaf",
  "url": "/landmarks/institutions/osmania-general-hospital/",
  "section": "Landmarks",
  "title": "Osmania General Hospital",
  "description": "Built in 1925 by the seventh Nizam Mir Osman Ali Khan, Osmania General Hospital stands on the Musi as part of his public-health programme.",
  "dedication": "In memory of the Asaf Jahi dynasty",
  "sort_order": 130,
  "tags": [
    "Osmania General Hospital",
    "Hyderabad",
    "Healthcare",
    "Nizam"
  ],
  "eyebrow": "Institutions of the Deccan",
  "title_html": "Osmania General Hospital",
  "subtitle": "Hyderabad · Built 1925",
  "link_terms": [
    "Osmania General Hospital"
  ],
  "blocks": [
    {
      "type": "facts",
      "items": [
        {
          "key": "Built",
          "value": "1925",
          "ref": "livehistoryindia-ogh"
        },
        {
          "key": "Style",
          "value": "Indo-Saracenic"
        },
        {
          "key": "City",
          "value": "Hyderabad"
        }
      ]
    },
    {
      "type": "narrative",
      "tour_label": "The Hospital",
      "tour": [
        {
          "id": "s1",
          "label": "After the Flood"
        },
        {
          "id": "s2",
          "label": "The Building"
        },
        {
          "id": "s3",
          "label": "Today"
        }
      ],
      "intro": "<p>The <em>Osmania General Hospital</em> on the north bank of the Musi was built in 1925 by the seventh Nizam <em>Mir Osman Ali Khan</em> as the central teaching hospital of the modern Hyderabad State. Conceived together with the Osmania Medical College across the river, it formed a single hospital-and-college complex on the lines of the great European medical schools of the period. Its long Indo-Saracenic block — a granite and stucco facade with two octagonal corner towers and a deep central arch — was part of the seventh Nizam's wider rebuilding of the city after the catastrophic <em>1908 Musi flood</em>, which had drowned much of the old riverside and forced a full reconsideration of Hyderabad's public infrastructure.<cite data-ref=\"livehistoryindia-ogh\"></cite></p>",
      "sections": [
        {
          "id": "s1",
          "eyebrow": "The Musi · 1908",
          "numeral_label": "After the Flood",
          "title_html": "After the <em>1908 flood</em>",
          "sub": "Rebuilding the riverside after a catastrophic flood",
          "body": [
            "The Musi flood of September 1908 killed several thousand people and swept away much of the old riverside. The seventh Nizam, then newly enthroned, commissioned the engineer Sir Mokshagundam Visvesvaraya to plan a new system of dams and embankments, and rebuilt the river frontage with a new hospital, a new High Court, the City College frontage and the State Central Library — a single coordinated programme of public buildings.<cite data-ref=\"livehistoryindia-ogh\"></cite>"
          ],
          "reveal": "reveal-left"
        },
        {
          "id": "s2",
          "eyebrow": "Indo-Saracenic",
          "numeral_label": "The Building",
          "title_html": "The <em>building</em>",
          "sub": "The signature architectural style of the seventh Nizam's reign",
          "body": [
            "The hospital was designed in the late Indo-Saracenic manner that became the signature of the seventh Nizam's reign: deep arches drawn from the Qutb Shahi past, octagonal corner towers, tile-work spandrels and a long horizontal mass set parallel to the river. It remains one of the most distinctive institutional silhouettes of Hyderabad."
          ],
          "reveal": "reveal-right"
        },
        {
          "id": "s3",
          "eyebrow": "A Teaching Hospital",
          "numeral_label": "Today",
          "title_html": "Continuing <em>service</em>",
          "sub": "Still the city's principal government teaching hospital",
          "body": [
            "Osmania General Hospital continues today as the principal government teaching hospital of the city, attached to Osmania Medical College. The condition of the original block has been the subject of several heritage campaigns; the building was listed in 2017 by the state heritage authority.<cite data-ref=\"wikipedia-ogh\"></cite>"
          ],
          "reveal": "reveal-left"
        }
      ]
    }
  ],
  "references": [
    {
      "id": "livehistoryindia-ogh",
      "text": "\"Osmania General Hospital: An Icon in Need of Intensive Care,\" Live History India.",
      "url": "https://www.livehistoryindia.com/story/monuments/osmania-hospital"
    },
    {
      "id": "wikipedia-ogh",
      "text": "Wikipedia, \"Osmania General Hospital.\"",
      "url": "https://en.wikipedia.org/wiki/Osmania_General_Hospital"
    }
  ],
  "indexing": "noindex"
}
