{
  "page_type": "institution_leaf",
  "url": "/landmarks/institutions/salar-jung-museum/",
  "section": "Landmarks",
  "title": "Salar Jung Museum",
  "description": "Opened in 1951, the Salar Jung Museum on the Musi holds the collection of Salar Jung III — the third-largest one-man art collection in the world.",
  "dedication": "In memory of the Asaf Jahi dynasty",
  "sort_order": 150,
  "tags": [
    "Salar Jung Museum",
    "Hyderabad",
    "Art Collection"
  ],
  "eyebrow": "Institutions of the Deccan",
  "title_html": "Salar Jung Museum",
  "subtitle": "Hyderabad · Opened 1951",
  "link_terms": [
    "Salar Jung Museum"
  ],
  "blocks": [
    {
      "type": "facts",
      "items": [
        {
          "key": "Opened",
          "value": "1951",
          "ref": "salar-jung-official"
        },
        {
          "key": "Collector",
          "value": "Salar Jung III"
        },
        {
          "key": "City",
          "value": "Hyderabad"
        }
      ]
    },
    {
      "type": "narrative",
      "tour_label": "The Museum",
      "tour": [
        {
          "id": "s1",
          "label": "The Collector"
        },
        {
          "id": "s2",
          "label": "The Museum"
        },
        {
          "id": "s3",
          "label": "The Galleries"
        }
      ],
      "intro": "<p>The <em>Salar Jung Museum</em>, opened to the public in 1951 on the south bank of the Musi, is the personal collection of <em>Mir Yousuf Ali Khan</em>, <em>Salar Jung III</em> — wazir of the seventh Nizam and one of the great collectors of the twentieth century. Across his lifetime Salar Jung III amassed some forty thousand objects from across the Islamic, European and Indian worlds: Mughal painting and Persian carpets; Qajar enamels and European porcelain; Italian marbles, French clocks, Japanese lacquer, Bidri-work, Qur'ans in <em>Kufic</em>, <em>Naskh</em> and <em>Thuluth</em> hands; and a library of fifty thousand books and manuscripts. It is said to be the third-largest one-man art collection in the world.<cite data-ref=\"wikipedia-salar-jung-museum\"></cite></p>",
      "sections": [
        {
          "id": "s1",
          "eyebrow": "Mir Yousuf Ali Khan",
          "numeral_label": "The Collector",
          "title_html": "The <em>collector</em>",
          "sub": "Four decades spent assembling a vast private collection",
          "body": [
            "Mir Yousuf Ali Khan succeeded his father as Salar Jung III in 1912 and served briefly as wazir to the seventh Nizam in 1914. Withdrawing thereafter from public life, he gave the next four decades to the building of his collection, scouring the auction houses of London, Paris, Cairo and Bombay and the private libraries of the wider Deccan. He died unmarried in 1949, leaving the entire collection to the nation.<cite data-ref=\"wikipedia-salar-jung-museum\"></cite>"
          ],
          "reveal": "reveal-left"
        },
        {
          "id": "s2",
          "eyebrow": "Opened by Nehru · 1951",
          "numeral_label": "The Museum",
          "title_html": "From <em>Diwan-Deodi</em> to museum",
          "sub": "From the family palace at Diwan-Deodi to a national museum",
          "body": [
            "The collection was first housed in the Salar Jung family palace at <em>Diwan-Deodi</em> in the old city, where it was opened to the public in December 1951 by Prime Minister Jawaharlal Nehru. Outgrowing the palace, the collection was moved in 1968 to a new purpose-built museum on the south bank of the Musi, where it remains.<cite data-ref=\"salar-jung-official\"></cite>"
          ],
          "reveal": "reveal-right"
        },
        {
          "id": "s3",
          "eyebrow": "Thirty-Nine Galleries",
          "numeral_label": "The Galleries",
          "title_html": "The <em>galleries</em>",
          "sub": "Islamic, European and Far Eastern art under one roof",
          "body": [
            "The thirty-nine galleries of the present museum range across Islamic, European and Far Eastern art — with particular strengths in Mughal jade and arms, Deccani painting, Persian and Turkish manuscripts, European nineteenth-century sculpture (the famous marble <em>Veiled Rebecca</em> by Giovanni Maria Benzoni is here), and a fine library of Arabic and Persian books. It is administered as one of the three National Museums of India.<cite data-ref=\"wikipedia-salar-jung-museum\"></cite>"
          ],
          "reveal": "reveal-left"
        }
      ]
    }
  ],
  "references": [
    {
      "id": "salar-jung-official",
      "text": "Salar Jung Museum, official website.",
      "url": "https://www.salarjungmuseum.in/"
    },
    {
      "id": "wikipedia-salar-jung-museum",
      "text": "Wikipedia, \"Salar Jung Museum.\"",
      "url": "https://en.wikipedia.org/wiki/Salar_Jung_Museum"
    }
  ],
  "indexing": "noindex"
}
