{
  "page_type": "institution_leaf",
  "url": "/landmarks/institutions/mahbub-college/",
  "section": "Landmarks",
  "title": "Mahbub College",
  "description": "Founded in 1862 at Secunderabad as the Anglo Vernacular School, later renamed Mahbub College for the sixth Nizam, Mir Mahbub Ali Khan.",
  "dedication": "In memory of the Asaf Jahi dynasty",
  "sort_order": 40,
  "tags": [
    "Mahbub College",
    "Hyderabad",
    "Education",
    "Nizam"
  ],
  "eyebrow": "Institutions of the Deccan",
  "title_html": "Mahbub College",
  "subtitle": "Secunderabad · Founded 1862",
  "link_terms": [
    "Mahbub College"
  ],
  "blocks": [
    {
      "type": "facts",
      "items": [
        {
          "key": "Founded",
          "value": "1862 · as the Anglo Vernacular School",
          "ref": "wikipedia-mahbub-college"
        },
        {
          "key": "Founder",
          "value": "Somasundaram Mudaliar",
          "ref": "wikipedia-mahbub-college"
        },
        {
          "key": "Renamed",
          "value": "For the sixth Nizam, Mir Mahbub Ali Khan",
          "ref": "wikipedia-mahbub-college"
        },
        {
          "key": "City",
          "value": "Secunderabad"
        }
      ]
    },
    {
      "type": "narrative",
      "tour_label": "The College",
      "tour": [
        {
          "id": "s1",
          "label": "The Founding"
        },
        {
          "id": "s2",
          "label": "The Campus"
        },
        {
          "id": "s3",
          "label": "A Long Roll"
        }
      ],
      "intro": "<p><em>Mahbub College</em> at Secunderabad began in 1862 as the <em>Anglo Vernacular School</em>, founded by <em>Somasundaram Mudaliar</em>. It was later renamed in honour of the young sovereign <em>Mir Mahbub Ali Khan</em>, the sixth Nizam, whose patronage supported the school's growth. Set up as a Western-style English-medium school for the sons of the state's officers and the British residency establishment at Secunderabad, it became, with its elegant colonnaded main block — still in use — one of the earliest institutions of Hyderabad to teach the modern sciences and English literature alongside Persian and Arabic, setting a model that the later Asafi schools and colleges of the city would follow.<cite data-ref=\"wikipedia-mahbub-college\"></cite></p>",
      "sections": [
        {
          "id": "s1",
          "eyebrow": "A School Renamed for a Nizam",
          "numeral_label": "The Founding",
          "title_html": "From <em>Anglo Vernacular School</em> to Mahbub College",
          "sub": "A Secunderabad school that took the sixth Nizam's name",
          "body": [
            "The school that became Mahbub College was founded in 1862 by Somasundaram Mudaliar as the Anglo Vernacular School. It was renamed for Mir Mahbub Ali Khan, the sixth Nizam, whose support helped establish it among the most prestigious English-medium schools in the state — part of the same era of educational expansion that, under Salar Jung I's reforming administration from 1853 onward, also produced City College, the engineering and survey schools, and the modern courts of Hyderabad State.<cite data-ref=\"karen-leonard-1978\"></cite>"
          ],
          "reveal": "reveal-left"
        },
        {
          "id": "s2",
          "eyebrow": "Secunderabad",
          "numeral_label": "The Campus",
          "title_html": "The <em>campus</em>",
          "sub": "A colonnaded Anglo-Indian block and broad playing fields",
          "body": [
            "The school occupies an extensive site at Secunderabad, with a colonnaded principal block in the late nineteenth-century Anglo-Indian institutional manner, a chapel-like assembly hall, and broad playing fields. The buildings have been added to repeatedly, but the original frontage remains."
          ],
          "reveal": "reveal-right"
        },
        {
          "id": "s3",
          "eyebrow": "The Twin Cities",
          "numeral_label": "A Long Roll",
          "title_html": "A long <em>roll</em>",
          "sub": "Educator of Hyderabad's civil and military officers",
          "body": [
            "Mahbub College has educated several generations of Hyderabad's civil and military officers, and remains a leading school of the twin cities. It is now Mahbub College High School, affiliated to the state board, and continues on its original campus.<cite data-ref=\"wikipedia-mahbub-college\"></cite>"
          ],
          "reveal": "reveal-left"
        }
      ]
    }
  ],
  "references": [
    {
      "id": "wikipedia-mahbub-college",
      "text": "Wikipedia, \"Mahbub College High School.\"",
      "url": "https://en.wikipedia.org/wiki/Mahbub_College_High_School"
    },
    {
      "id": "karen-leonard-1978",
      "text": "Karen Leonard, Social History of an Indian Caste: The Kayasths of Hyderabad, University of California Press, 1978."
    }
  ],
  "indexing": "noindex"
}
