{
  "page_type": "institution_leaf",
  "url": "/landmarks/institutions/osmania-medical-college/",
  "section": "Landmarks",
  "title": "Osmania Medical College",
  "description": "Osmania Medical College in historical context: the 1846 Hyderabad Medical School, Urdu-medium medical education, its Bolarum predecessor, early graduates, women students, and later Osmania-era development.",
  "dedication": "In memory of the Asaf Jahi dynasty",
  "sort_order": 100,
  "tags": [
    "Osmania Medical College",
    "Hyderabad",
    "Medicine",
    "Nizam"
  ],
  "eyebrow": "Institutions of the Deccan",
  "title_html": "Osmania Medical College",
  "subtitle": "Hyderabad · Founded 1846 · Renamed 1919",
  "link_terms": [
    "Osmania Medical College"
  ],
  "blocks": [
    {
      "type": "facts",
      "items": [
        {
          "key": "Predecessor",
          "value": "Hyderabad Medical School · 1846",
          "ref": "omc-official"
        },
        {
          "key": "Early medium",
          "value": "Urdu",
          "ref": "omc-official"
        },
        {
          "key": "Early qualification",
          "value": "Hakeem",
          "ref": "omc-official"
        },
        {
          "key": "First superintendent",
          "value": "Dr. William Campbell Maclean",
          "ref": "omc-official"
        },
        {
          "key": "Later identity",
          "value": "Osmania Medical College",
          "ref": "omc-official"
        }
      ]
    },
    {
      "type": "narrative",
      "tour_label": "The Medical College",
      "tour": [
        {
          "id": "s1",
          "label": "Before 1846"
        },
        {
          "id": "s2",
          "label": "Hyderabad Medical School"
        },
        {
          "id": "s3",
          "label": "Training & Examinations"
        },
        {
          "id": "s4",
          "label": "Women & Expansion"
        },
        {
          "id": "s5",
          "label": "Osmania Era"
        }
      ],
      "intro": "<p>The institutional history of <em>Osmania Medical College</em> reaches back to the Hyderabad Medical School established in 1846. The college’s own historical record describes an Urdu-medium school created to teach European medicine to students of the Deccan, while also placing that experiment within Hyderabad’s much older medical culture.<cite data-ref=\"omc-official\"></cite></p>",
      "sections": [
        {
          "id": "s1",
          "eyebrow": "Bolarum · Before 1846",
          "numeral_label": "The Predecessor",
          "title_html": "An earlier medical school at <em>Bolarum</em>",
          "sub": "The 1846 institution did not appear from nowhere",
          "body": [
            "Osmania Medical College’s official history records an earlier medical school at Bolarum, started in the late 1830s by British medical officers attached to the Hyderabad Contingent. Its purpose was to train local men as medical subordinates for military service. That school closed in May 1846, immediately before the new Hyderabad Medical School was organized with a broader purpose.<cite data-ref=\"omc-official\"></cite>",
            "This predecessor is important because it separates two institutional histories that are often compressed into a single founding story: an earlier military training school at Bolarum, and the later Hyderabad Medical School that became the direct forerunner of Osmania Medical College."
          ],
          "reveal": "reveal-right"
        },
        {
          "id": "s2",
          "eyebrow": "Hyderabad · 1846",
          "numeral_label": "The New School",
          "title_html": "European medicine taught through <em>Urdu</em>",
          "sub": "A vernacular-medium medical school for students of the Deccan",
          "body": [
            "The official college history says the Hyderabad Medical School was established in 1846 after the Nizam approved a plan to teach European medicine to local students through Urdu. Dr. William Campbell Maclean was appointed superintendent and teacher, supported by staff including a translator and clerk.<cite data-ref=\"omc-official\"></cite>",
            "The choice of Urdu is one of the institution’s most distinctive features. Medical knowledge that circulated through English-language colonial institutions was translated into a language used by the Hyderabad State’s educated public and administration, creating an unusual vernacular route into modern medical education.<cite data-ref=\"omc-official\"></cite>"
          ],
          "reveal": "reveal-left"
        },
        {
          "id": "s3",
          "eyebrow": "1852–53",
          "numeral_label": "Training",
          "title_html": "The first <em>qualified cohort</em>",
          "sub": "A formal examination linked the school to wider medical standards",
          "body": [
            "According to the college’s institutional record, the first trained students were examined in 1852–53 by a committee of medical officers. Ten candidates were declared qualified and received official diplomas. By the end of the nineteenth century, the school had developed a larger staff and a formal examination system connected with the standards used by the Madras medical establishment.<cite data-ref=\"omc-official\"></cite>",
            "That progression—from a small school with translated instruction to an established professional institution—helps explain why the 1846 date matters. It marks the beginning of a durable state-backed system of medical training rather than a short-lived classroom experiment."
          ],
          "reveal": "reveal-right"
        },
        {
          "id": "s4",
          "eyebrow": "Late 19th Century",
          "numeral_label": "Expansion",
          "title_html": "Women enter the <em>medical school</em>",
          "sub": "A Zenana section expanded access to medical training",
          "body": [
            "The official history notes that a women’s, or Zenana, section was opened in the final decade of the nineteenth century under the supervision of a woman doctor. Women students were admitted to study medicine, with particular attention to midwifery.<cite data-ref=\"omc-official\"></cite>",
            "This development is significant in the history of public health in Hyderabad because it connected medical education with the practical need for women practitioners who could serve female patients in a society where access to male physicians could be restricted by custom."
          ],
          "reveal": "reveal-left"
        },
        {
          "id": "s5",
          "eyebrow": "20th Century",
          "numeral_label": "Osmania Era",
          "title_html": "From Hyderabad Medical School to <em>Osmania</em>",
          "sub": "The nineteenth-century school became part of Hyderabad’s modern university system",
          "body": [
            "The institution later became associated with the Osmania educational system established under Mir Osman Ali Khan. The college’s own history identifies the 1846 Hyderabad Medical School as the direct forerunner of Osmania Medical College and traces the continuity of medical education through Hyderabad’s transition from princely state to modern state capital.<cite data-ref=\"omc-official\"></cite>",
            "For Dakhni.org, the value of the college is therefore larger than a single founding date. It connects Urdu-medium professional education, translation, state administration, women’s medical training and the modernization of Hyderabad across more than a century."
          ],
          "reveal": "reveal-right"
        }
      ]
    }
  ],
  "references": [
    {
      "id": "omc-official",
      "text": "Osmania Medical College, official institutional history — “About OMC.”",
      "url": "https://omc.ac.in/about-omc.php"
    }
  ]
}
