{
  "page_type": "institution_leaf",
  "url": "/landmarks/institutions/college-of-engineering/",
  "section": "Landmarks",
  "title": "College of Engineering",
  "description": "Founded in 1929 by the seventh Nizam as the Hyderabad State College of Engineering, now JNTU Hyderabad — a principal engineering institution of the state.",
  "dedication": "In memory of the Asaf Jahi dynasty",
  "sort_order": 140,
  "tags": [
    "College of Engineering",
    "Hyderabad",
    "Engineering",
    "Osmania University"
  ],
  "eyebrow": "Institutions of the Deccan",
  "title_html": "College of Engineering",
  "subtitle": "Hyderabad · Founded 1929 · Now JNTU",
  "link_terms": [
    "College of Engineering"
  ],
  "blocks": [
    {
      "type": "facts",
      "items": [
        {
          "key": "Founded",
          "value": "1929",
          "ref": "uceou-official"
        },
        {
          "key": "Founder",
          "value": "Osman Ali Khan"
        },
        {
          "key": "Now",
          "value": "JNTU Hyderabad"
        }
      ]
    },
    {
      "type": "narrative",
      "tour_label": "The College",
      "tour": [
        {
          "id": "s1",
          "label": "Founding"
        },
        {
          "id": "s2",
          "label": "The Builders"
        },
        {
          "id": "s3",
          "label": "JNTU"
        }
      ],
      "intro": "<p>The <em>College of Engineering</em> at Hyderabad — now <em>JNTU Hyderabad</em> — was founded in 1929 by the seventh Nizam <em>Mir Osman Ali Khan</em> as the <em>Hyderabad State College of Engineering</em>. It was the technical arm of the same modernisation programme that built the city's hospitals, libraries, railways and electrification, and it produced the engineers and architects who carried out much of the work itself. Brought initially under Osmania University, the college taught civil, mechanical, electrical and later telecommunications engineering, and trained the first generations of Deccani engineers, surveyors and works officers.<cite data-ref=\"uceou-official\"></cite></p>",
      "sections": [
        {
          "id": "s1",
          "eyebrow": "Part of Osmania · 1929",
          "numeral_label": "Founding",
          "title_html": "The <em>founding</em>",
          "sub": "An engineering college for the new technical state",
          "body": [
            "The college was conceived as a part of Osmania University, then a decade old, and was placed at the Chaderghat campus before being moved to a larger site. Its early faculty included Indian engineers trained at Roorkee and at the great English engineering schools, alongside European specialists recruited to staff the new departments."
          ],
          "reveal": "reveal-left"
        },
        {
          "id": "s2",
          "eyebrow": "Dams & Irrigation",
          "numeral_label": "The Builders",
          "title_html": "Within <em>Osmania</em>",
          "sub": "Four decades rebuilding Hyderabad's public works",
          "body": [
            "For four decades the college functioned as the Engineering College of Osmania University. It contributed in large measure to the rebuilding of Hyderabad after the 1908 flood, the construction of the Nizamsagar dam and the wider irrigation and railway programmes of the Asafi state, and was one of the principal engineering schools of the Deccan.<cite data-ref=\"uceou-official\"></cite>"
          ],
          "reveal": "reveal-right"
        },
        {
          "id": "s3",
          "eyebrow": "Reorganised · 1972",
          "numeral_label": "JNTU",
          "title_html": "<em>JNTU</em> Hyderabad",
          "sub": "The principal campus of the state technical university",
          "body": [
            "In 1972 the engineering colleges of Andhra Pradesh were placed under a new state technical university — Jawaharlal Nehru Technological University — of which the Hyderabad College of Engineering became the principal campus. After the 2008 reorganisation, it became JNTU Hyderabad, and is now one of the larger technical universities of South India.<cite data-ref=\"jntuh-official\"></cite>"
          ],
          "reveal": "reveal-left"
        }
      ]
    }
  ],
  "references": [
    {
      "id": "uceou-official",
      "text": "University College of Engineering, Osmania University — official website, About Us.",
      "url": "https://www.uceou.edu/"
    },
    {
      "id": "jntuh-official",
      "text": "Jawaharlal Nehru Technological University Hyderabad — official website, About JNTUH.",
      "url": "https://jntuh.ac.in/about-us"
    }
  ],
  "indexing": "noindex"
}
